23:45:22.076719 IP 138.197.163.115.ssh > mctnnbsa45w-142-162-63-0.dhcp-dynamic.fibreop.nb.bellaliant.net.64557: Flags [P.], seq 1916744:1916956, ack 937, win 63360, length 212
23:45:22.076835 IP 138.197.163.115.ssh > mctnnbsa45w-142-162-63-0.dhcp-dynamic.fibreop.nb.bellaliant.net.64557: Flags [P.], seq 1916956:1917168, ack 937, win 63360, length 212
23:45:22.076949 IP 138.197.163.115.ssh > mctnnbsa45w-142-162-63-0.dhcp-dynamic.fibreop.nb.bellaliant.net.64557: Flags [P.], seq 1917168:1917380, ack 937, win 63360, length 212
23:45:22.077063 IP 138.197.163.115.ssh > mctnnbsa45w-142-162-63-0.dhcp-dynamic.fibreop.nb.bellaliant.net.64557: Flags [P.], seq 1917380:1917592, ack 937, win 63360, length 212
23:45:22.077175 IP 138.197.163.115.ssh > mctnnbsa45w-142-162-63-0.dhcp-dynamic.fibreop.nb.bellaliant.net.64557: Flags [P.], seq 1917592:1917804, ack 937, win 63360, length 212
23:45:22.077309 IP 138.197.163.115.ssh > mctnnbsa45w-142-162-63-0.dhcp-dynamic.fibreop.nb.bellaliant.net.64557: Flags [P.], seq 1917804:1918016, ack 937, win 63360, length 212
23:45:22.077440 IP 138.197.163.115.ssh > mctnnbsa45w-142-162-63-0.dhcp-dynamic.fibreop.nb.bellaliant.net.64557: Flags [P.], seq 1918016:1918228, ack 937, win 63360, length 212
23:45:22.077558 IP 138.197.163.115.ssh > mctnnbsa45w-142-162-63-0.dhcp-dynamic.fibreop.nb.bellaliant.net.64557: Flags [P.], seq 1918228:1918440, ack 937, win 63360, length 212
23:45:22.077671 IP 138.197.163.115.ssh > mctnnbsa45w-142-162-63-0.dhcp-dynamic.fibreop.nb.bellaliant.net.64557: Flags [P.], seq 1918440:1918652, ack 937, win 63360, length 212
23:45:22.077784 IP 138.197.163.115.ssh > mctnnbsa45w-142-162-63-0.dhcp-dynamic.fibreop.nb.bellaliant.net.64557: Flags [P.], seq 1918652:1918864, ack 937, win 63360, length 212
23:45:22.077893 IP 138.197.163.115.ssh > mctnnbsa45w-142-162-63-0.dhcp-dynamic.fibreop.nb.bellaliant.net.64557: Flags [P.], seq 1918864:1919076, ack 937, win 63360, length 212
23:45:22.078051 IP 138.197.163.115.ssh > mctnnbsa45w-142-162-63-0.dhcp-dynamic.fibreop.nb.bellaliant.net.64557: Flags [P.], seq 1919076:1919288, ack 937, win 63360, length 212
23:45:22.078187 IP 138.197.163.115.ssh > mctnnbsa45w-142-162-63-0.dhcp-dynamic.fibreop.nb.bellaliant.net.64557: Flags [P.], seq 1919288:1919500, ack 937, win 63360, length 212
23:45:22.078307 IP 138.197.163.115.ssh > mctnnbsa45w-142-162-63-0.dhcp-dynamic.fibreop.nb.bellaliant.net.64557: Flags [P.], seq 1919500:1919712, ack 937, win 63360, length 212
23:45:22.078419 IP 138.197.163.115.ssh > mctnnbsa45w-142-162-63-0.dhcp-dynamic.fibreop.nb.bellaliant.net.64557: Flags [P.], seq 1919712:1919924, ack 937, win 63360, length 212
23:45:22.078533 IP 138.197.163.115.ssh > mctnnbsa45w-142-162-63-0.dhcp-dynamic.fibreop.nb.bellaliant.net.64557: Flags [P.], seq 1919924:1920136, ack 937, win 63360, length 212
23:45:22.078650 IP 138.197.163.115.ssh > mctnnbsa45w-142-162-63-0.dhcp-dynamic.fibreop.nb.bellaliant.net.64557: Flags [P.], seq 1920136:1920348, ack 937, win 63360, length 212
23:45:22.078761 IP 138.197.163.115.ssh > mctnnbsa45w-142-162-63-0.dhcp-dynamic.fibreop.nb.bellaliant.net.64557: Flags [P.], seq 1920348:1920560, ack 937, win 63360, length 212
23:45:22.078883 IP 138.197.163.115.ssh > mctnnbsa45w-142-162-63-0.dhcp-dynamic.fibreop.nb.bellaliant.net.64557: Flags [P.], seq 1920560:1920772, ack 937, win 63360, length 212
23:45:22.078994 IP 138.197.163.115.ssh > mctnnbsa45w-142-162-63-0.dhcp-dynamic.fibreop.nb.bellaliant.net.64557: Flags [P.], seq 1920772:1920984, ack 937, win 63360, length 212
23:45:22.079166 IP 138.197.163.115.ssh > mctnnbsa45w-142-162-63-0.dhcp-dynamic.fibreop.nb.bellaliant.net.64557: Flags [P.], seq 1920984:1921196, ack 937, win 63360, length 212
23:45:22.079289 IP 138.197.163.115.ssh > mctnnbsa45w-142-162-63-0.dhcp-dynamic.fibreop.nb.bellaliant.net.64557: Flags [P.], seq 1921196:1921408, ack 937, win 63360, length 212
23:45:22.079401 IP 138.197.163.115.ssh > mctnnbsa45w-142-162-63-0.dhcp-dynamic.fibreop.nb.bellaliant.net.64557: Flags [P.], seq 1921408:1921620, ack 937, win 63360, length 212
23:45:22.079517 IP 138.197.163.115.ssh > mctnnbsa45w-142-162-63-0.dhcp-dynamic.fibreop.nb.bellaliant.net.64557: Flags [P.], seq 1921620:1921832, ack 937, win 63360, length 212
23:45:22.079631 IP 138.197.163.115.ssh > mctnnbsa45w-142-162-63-0.dhcp-dynamic.fibreop.nb.bellaliant.net.64557: Flags [P.], seq 1921832:1922044, ack 937, win 63360, length 212
23:45:22.079743 IP 138.197.163.115.ssh > mctnnbsa45w-142-162-63-0.dhcp-dynamic.fibreop.nb.bellaliant.net.64557: Flags [P.], seq 1922044:1922256, ack 937, win 63360, length 212
23:45:22.079856 IP 138.197.163.115.ssh > mctnnbsa45w-142-162-63-0.dhcp-dynamic.fibreop.nb.bellaliant.net.64557: Flags [P.], seq 1922256:1922468, ack 937, win 63360, length 212
23:45:22.079930 IP mctnnbsa45w-142-162-63-0.dhcp-dynamic.fibreop.nb.bellaliant.net.64557 > 138.197.163.115.ssh: Flags [P.], seq 937:1009, ack 1879428, win 64240, length 72
^C
9201 packets captured
9202 packets received by filter
0 packets dropped by kernel