reading from file 0001.pcap, link-type EN10MB (Ethernet)
00:10:01.407715 IP 138.197.163.115.ssh > mctnnbsa45w-142-162-63-0.dhcp-dynamic.fibreop.nb.bellaliant.net.64557: Flags [P.], seq 4096562662:4096562706, ack 1382396352, win 65535, length 44
00:10:01.407851 IP 138.197.163.115.ssh > mctnnbsa45w-142-162-63-0.dhcp-dynamic.fibreop.nb.bellaliant.net.64557: Flags [P.], seq 44:152, ack 1, win 65535, length 108
00:10:01.407939 IP 138.197.163.115.ssh > mctnnbsa45w-142-162-63-0.dhcp-dynamic.fibreop.nb.bellaliant.net.64557: Flags [P.], seq 152:188, ack 1, win 65535, length 36
00:10:01.430753 IP mctnnbsa45w-142-162-63-0.dhcp-dynamic.fibreop.nb.bellaliant.net.64557 > 138.197.163.115.ssh: Flags [.], ack 188, win 64016, length 0