00:11:39.182387 IP 138.197.163.115.22 > 142.162.63.0.64557: Flags [P.], seq 1026112:1026276, ack 541, win 65535, length 164
00:11:39.182514 IP 138.197.163.115.22 > 142.162.63.0.64557: Flags [P.], seq 1026276:1026440, ack 541, win 65535, length 164
00:11:39.182633 IP 138.197.163.115.22 > 142.162.63.0.64557: Flags [P.], seq 1026440:1026604, ack 541, win 65535, length 164
00:11:39.182745 IP 138.197.163.115.22 > 142.162.63.0.64557: Flags [P.], seq 1026604:1026768, ack 541, win 65535, length 164
00:11:39.182859 IP 138.197.163.115.22 > 142.162.63.0.64557: Flags [P.], seq 1026768:1026932, ack 541, win 65535, length 164
00:11:39.182979 IP 138.197.163.115.22 > 142.162.63.0.64557: Flags [P.], seq 1026932:1027096, ack 541, win 65535, length 164
00:11:39.183112 IP 138.197.163.115.22 > 142.162.63.0.64557: Flags [P.], seq 1027096:1027260, ack 541, win 65535, length 164
00:11:39.183226 IP 138.197.163.115.22 > 142.162.63.0.64557: Flags [P.], seq 1027260:1027424, ack 541, win 65535, length 164
00:11:39.183337 IP 138.197.163.115.22 > 142.162.63.0.64557: Flags [P.], seq 1027424:1027588, ack 541, win 65535, length 164
00:11:39.183459 IP 138.197.163.115.22 > 142.162.63.0.64557: Flags [P.], seq 1027588:1027752, ack 541, win 65535, length 164
00:11:39.183584 IP 138.197.163.115.22 > 142.162.63.0.64557: Flags [P.], seq 1027752:1027916, ack 541, win 65535, length 164
00:11:39.183702 IP 138.197.163.115.22 > 142.162.63.0.64557: Flags [P.], seq 1027916:1028080, ack 541, win 65535, length 164
00:11:39.183817 IP 138.197.163.115.22 > 142.162.63.0.64557: Flags [P.], seq 1028080:1028244, ack 541, win 65535, length 164
00:11:39.183932 IP 138.197.163.115.22 > 142.162.63.0.64557: Flags [P.], seq 1028244:1028408, ack 541, win 65535, length 164
00:11:39.184046 IP 138.197.163.115.22 > 142.162.63.0.64557: Flags [P.], seq 1028408:1028572, ack 541, win 65535, length 164
00:11:39.184157 IP 138.197.163.115.22 > 142.162.63.0.64557: Flags [P.], seq 1028572:1028736, ack 541, win 65535, length 164
00:11:39.184272 IP 138.197.163.115.22 > 142.162.63.0.64557: Flags [P.], seq 1028736:1028900, ack 541, win 65535, length 164
00:11:39.184382 IP 138.197.163.115.22 > 142.162.63.0.64557: Flags [P.], seq 1028900:1029064, ack 541, win 65535, length 164
00:11:39.184498 IP 138.197.163.115.22 > 142.162.63.0.64557: Flags [P.], seq 1029064:1029228, ack 541, win 65535, length 164
00:11:39.184616 IP 138.197.163.115.22 > 142.162.63.0.64557: Flags [P.], seq 1029228:1029392, ack 541, win 65535, length 164
00:11:39.184725 IP 138.197.163.115.22 > 142.162.63.0.64557: Flags [P.], seq 1029392:1029556, ack 541, win 65535, length 164
00:11:39.184838 IP 138.197.163.115.22 > 142.162.63.0.64557: Flags [P.], seq 1029556:1029720, ack 541, win 65535, length 164
00:11:39.184956 IP 138.197.163.115.22 > 142.162.63.0.64557: Flags [P.], seq 1029720:1029884, ack 541, win 65535, length 164
00:11:39.185066 IP 138.197.163.115.22 > 142.162.63.0.64557: Flags [P.], seq 1029884:1030048, ack 541, win 65535, length 164
00:11:39.185183 IP 138.197.163.115.22 > 142.162.63.0.64557: Flags [P.], seq 1030048:1030212, ack 541, win 65535, length 164
00:11:39.185306 IP 138.197.163.115.22 > 142.162.63.0.64557: Flags [P.], seq 1030212:1030376, ack 541, win 65535, length 164
00:11:39.185422 IP 138.197.163.115.22 > 142.162.63.0.64557: Flags [P.], seq 1030376:1030540, ack 541, win 65535, length 164
00:11:39.185538 IP 138.197.163.115.22 > 142.162.63.0.64557: Flags [P.], seq 1030540:1030704, ack 541, win 65535, length 164
00:11:39.185655 IP 138.197.163.115.22 > 142.162.63.0.64557: Flags [P.], seq 1030704:1030868, ack 541, win 65535, length 164
00:11:39.185770 IP 138.197.163.115.22 > 142.162.63.0.64557: Flags [P.], seq 1030868:1031032, ack 541, win 65535, length 164
00:11:39.185883 IP 138.197.163.115.22 > 142.162.63.0.64557: Flags [P.], seq 1031032:1031196, ack 541, win 65535, length 164
00:11:39.185993 IP 138.197.163.115.22 > 142.162.63.0.64557: Flags [P.], seq 1031196:1031360, ack 541, win 65535, length 164
00:11:39.186120 IP 138.197.163.115.22 > 142.162.63.0.64557: Flags [P.], seq 1031360:1031524, ack 541, win 65535, length 164
00:11:39.186245 IP 138.197.163.115.22 > 142.162.63.0.64557: Flags [P.], seq 1031524:1031688, ack 541, win 65535, length 164
00:11:39.186366 IP 138.197.163.115.22 > 142.162.63.0.64557: Flags [P.], seq 1031688:1031852, ack 541, win 65535, length 164
00:11:39.186483 IP 138.197.163.115.22 > 142.162.63.0.64557: Flags [P.], seq 1031852:1032016, ack 541, win 65535, length 164
00:11:39.186595 IP 138.197.163.115.22 > 142.162.63.0.64557: Flags [P.], seq 1032016:1032180, ack 541, win 65535, length 164
00:11:39.186707 IP 138.197.163.115.22 > 142.162.63.0.64557: Flags [P.], seq 1032180:1032344, ack 541, win 65535, length 164
00:11:39.186824 IP 138.197.163.115.22 > 142.162.63.0.64557: Flags [P.], seq 1032344:1032508, ack 541, win 65535, length 164
00:11:39.186943 IP 138.197.163.115.22 > 142.162.63.0.64557: Flags [P.], seq 1032508:1032672, ack 541, win 65535, length 164
00:11:39.187053 IP 138.197.163.115.22 > 142.162.63.0.64557: Flags [P.], seq 1032672:1032836, ack 541, win 65535, length 164
00:11:39.187188 IP 138.197.163.115.22 > 142.162.63.0.64557: Flags [P.], seq 1032836:1033000, ack 541, win 65535, length 164
00:11:39.187318 IP 138.197.163.115.22 > 142.162.63.0.64557: Flags [P.], seq 1033000:1033164, ack 541, win 65535, length 164
00:11:39.187434 IP 138.197.163.115.22 > 142.162.63.0.64557: Flags [P.], seq 1033164:1033328, ack 541, win 65535, length 164
00:11:39.187544 IP 138.197.163.115.22 > 142.162.63.0.64557: Flags [P.], seq 1033328:1033492, ack 541, win 65535, length 164
00:11:39.187655 IP 138.197.163.115.22 > 142.162.63.0.64557: Flags [P.], seq 1033492:1033656, ack 541, win 65535, length 164
00:11:39.187774 IP 138.197.163.115.22 > 142.162.63.0.64557: Flags [P.], seq 1033656:1033820, ack 541, win 65535, length 164
00:11:39.187869 IP 142.162.63.0.64557 > 138.197.163.115.22: Flags [.], ack 990224, win 64240, length 0
00:11:39.187869 IP 142.162.63.0.64557 > 138.197.163.115.22: Flags [.], ack 992192, win 64240, length 0
00:11:39.187869 IP 142.162.63.0.64557 > 138.197.163.115.22: Flags [.], ack 994488, win 64240, length 0
00:11:39.187869 IP 142.162.63.0.64557 > 138.197.163.115.22: Flags [P.], seq 541:577, ack 994488, win 64240, length 36
00:11:39.187960 IP 142.162.63.0.64557 > 138.197.163.115.22: Flags [P.], seq 577:613, ack 994488, win 64240, length 36
00:11:39.187960 IP 142.162.63.0.64557 > 138.197.163.115.22: Flags [.], ack 996620, win 64240, length 0
^C
6541 packets captured
6542 packets received by filter
0 packets dropped by kernel